page_number,sentence_chunk,chunk_token_count
-41,"CESSNA MODEL 172S NOTICE INTRODUCTION AT THE TIME OF ISSUANCE, THIS INFORMATION MANUAL WAS AN EXACT DUPLICATE OF THE OFFICIAL PILOT'S OPERATING HANDBOOK AND FAA APPROVED AIRPLANE FLIGHT MANUAL AND IS TO BE USED FOR GENERAL PURPOSES ONLY. IT WILL NOT BE KEPT CURRENT AND, THEREFORE, CANNOT BE USED AS A SUBSTITUTE FOR THE OFFICIAL PILOT'S OPERATING HANDBOOK AND FAA APPROVED AIRPLANE FLIGHT MANUAL INTENDED FOR OPERATION OF THE AIRPLANE. THE PILOT'S OPERATING HANDBOOK MUST BE CARRIED IN THE AIRPLANE AND AVAILABLE TO THE PILOT AT ALL TIMES. I Revision 5 Cessna Aircraft Company Original Issue - 8 July 1998 Revision 5 - 19 July 2004 U.  S.",159.75
-40,"INTRODUCTION CESSNA MODEL 172S PERFORMANCE - SPECIFICATIONS *SPEED: Maximum at Sea Level ......................... 126 KNOTS Cruise, 75% Power at 8500 Feet. .................124 KNOTS CRUISE: Recommended lean mixture with fuel allowance for engine start, taxi, takeoff, climb and 45 minutes reserve. 75% Power at 8500 Feet ..................... Range - 518 NM 53 Gallons Usable Fuel. .................... Time - 4.26 HRS Range at 10,000 Feet, 45% Power ............. Range - 638 NM 53 Gallons Usable Fuel. .................... Time - 6.72 HRS RATE-OF-CLIMB AT SEA LEVEL ...................... 730 FPM SERVICE CEILING ............................. 14,000 FEET TAKEOFF PERFORMANCE: Ground Roll .................................... 960 FEET Total Distance Over 50 Foot Obstacle ............... 1630 FEET LANDING PERFORMANCE: Ground Roll .................................... 575 FEET Total Distance Over 50 Foot Obstacle ............... 1335 FEET STALL SPEED: Flaps Up, Power Off .............................. 53 KCAS Flaps Down, Power Off ........................... .48 KCAS MAXIMUM WEIGHT: Ramp ..................................... 2558 POUNDS Takeoff .................................... 2550 POUNDS Landing ................................... 2550 POUNDS STANDARD EMPTY WEIGHT .................... 1663 POUNDS MAXIMUM USEFUL LOAD ....................... 895 POUNDS BAGGAGE ALLOWANCE ........................ 120 POUNDS (Continued Next Page) I ii U.  S. Revision 5",366.5
-39,"CESSNA MODEL 172S INTRODUCTION PERFORMANCE - SPECIFICATIONS (Continued) WING LOADING: Lbs/Sq.  Ft. ............................. 14.7 POWER LOADING: Lbs/HP .............................. 14.2 FUEL CAPACITY ............................... 56 GALLONS OIL CAPACITY .................................. 8 QUARTS ENGINE: Textron Lycoming ......................... I0-360-L2A 180 BHP at 2700 RPM PROPELLER: Fixed Pitch, Diameter .................. 76 INCHES NOTE *Speed performance is shown for an airplane equipped with speed fairings which increase the speeds by approximately 2 knots.  There is a corresponding difference in range, while all other performance figures are unchanged when speed fairings are installed. The above performance figures are based on airplane weights at 2550 pounds, standard atmospheric conditions, level, hard-surfaced dry runways and no wind.  They are calculated values derived from flight tests conducted by Cessna Aircraft Company under carefully documented conditions and will vary with individual airplanes and numerous factors affecting flight performance. I Revision 5 U.  S. iii/iv",278.25
-37,"CESSNA MODEL 172S INTRODUCTION Information Manual SKYHAVVK Cessna Aircraft Company Model 1728 THIS MANUAL INCORPORATES INFORMATION ISSUED IN THE PILOT'S OPERATING HANDBOOK AND FAA APPROVED AIRPLANE FLIGHT MANUAL AT REVISION 5 DATED 19 JULY 2004 (PART NUMBER 172SPHUS05). COPYRIGHT© 1998 CESSNA AIRCRAFT COMPANY WICHITA, KANSAS USA I Revision 5 U.  S. 172SIM v/vi",90.5
-35,"CESSNA MODEL 172S INTRODUCTION TABLE OF CONTENTS SECTION GENERAL .............................................. 1 LIMITATIONS ............................................ 2 EMERGENCY PROCEDURES .............................. 3 NORMAL PROCEDURES .................................. 4 PERFORMANCE ......................................... 5 WEIGHT AND BALANCE/EQUIPMENT LIST ................... 6 AIRPLANE AND SYSTEMS DESCRIPTION .................... 7 HANDLING, SERVICE AND MAINTENANCE ................... 8 SUPPLEMENTS ......................................... 9 I Revision 5 U.  S. vii/viii",147.5
-33,CESSNA MODEL 172S SECTION 1 GENERAL TABLE OF CONTENTS Three View - Normal Ground Attitude SECTION 1 GENERAL Page 1-2 Introduction . . . . . . . . . . . . . . . . . . . . . . . . . . . . . . . . . . . . . . 1-4 Descriptive Data . . . . . . . . . . . . . . . . . . . . . . . . . . . . . . . . . . 1-4 Engine . . . . . . . . . . . . . . . . . . . . . . . . . . . . . . . . . . . . . . . 1-4 Propeller . . . . . . . . . . . . . . . . . . . . . . . . . . . . . . . . . . . . . . 1-4 Fuel . . . . . . . . . . . . . . . . . . . . . . . . . . . . . . . . . . . . . . . . . 1-4 Oil . . . . . . . . . . . . . . . . . . . . . . . . . . . . . . . . . . . . . . . . . . 1-5 Maximum Certificated Weights . . . . . . . . . . . . . . . . . . . . . 1-6 Standard Airplane Weights . . . . . . . . . . . . . . . . . . . . . . . . 1-7 Cabin And Entry Dimensions . . . . . . . . . . . . . . . . . . . . . . . 1-7 Baggage Space And Entry Dimensions . . . . . . . . . . . . . . .,238.75
-33,"1-7 Specific Loadings . . . . . . . . . . . . . . . . . . . . . . . . . . . . . . . 1-7 Symbols, Abbreviations and Terminology . . . . . . . . . . . . . . . . 1-8 General Airspeed Terminology And Symbols . . . . . . . . . . . 1-8 Meteorological Terminology . . . . . . . . . . . . . . . . . . . . . . . . 1-9 Engine Power Terminology . . . . . . . . . . . . . . . . . . . . . . . . 1-9 Airplane Performance And Flight Planning Terminology 1-10 WeightAndBalanceTerminology .................. 1-11 Metric I Imperial I U.  S. Conversion Charts . . . . . . . . . . . . . . 1-13 Weight Conversions . . . . . . . . . . . . . . . . . . . . . . . . . . . . 1-14 Length Conversions . . . . . . . . . . . . . . . . . . . . . . . . . . . . 1-16 Distance Conversions . . . . . . . . . . . . . . . . . . . . . . . . . . . 1-20 Volume Conversions . . . . . . . . . . . . . . . . . . . . . . . . . . . .",222.0
-33,1-21 Temperature Conversions . . . . . . . . . . . . . . . . . . . . . . . . 1-24 Hectopascals ~o Inches Me_rcury ............... · · · · 1-251 Volume to Weight Conversions . . . . . . . . . . . . . . . . . . . . 1-26 Quick Conversions . . . . . . . . . . . . . . . . . . . . . . . . . 1-27/1-28 Revision 4 1-1,77.5
-32,"SECTION 1 GENERAL CESSNA MODEL 172S ---------36'-1"" --------- 76"" MAX _. Figure 1-1.  Three View - Normal Ground Attitude (Sheet 1 of 2) 0510T1005 0510T1005 1-2 Revision 4",42.75
-31,"CESSNA MODEL 172S SECTION 1 GENERAL 1 NOTE 1: WING SPAN SHOWN WITH STROBE LIGHTS INSTALLED. NOTE 2: WHEEL BASE LENGTH IS 65"". NOTE 3: PROPELLER GROUND CLEARANCE IS 11 1/4"". NOTE 4: WING AREA IS 174 SQUARE FEET. NOTE 5: MINIMUM TURNING RADIUS (* PIVOT POINT TO OUTBOARD WING TIP) IS 27'-5 1/2"". NOTE 6: NORMAL GROUND ATTITUDE IS SHOWN WITH NOSE STRUT SHOWING APPROXIMATELY 2"" OF STRUT, AND WINGS LEVEL. 0510T1005 _.. Figure 1-1.  Three View - Normal Ground Attitude (Sheet 2) Revision 4 1-3",122.25
-30,"SECTION 1 GENERAL INTRODUCTION CESSNA MODEL 172S I This handbook contains 9 sections, and includes the material required to be furnished to the pilot by FAR Part 23.  It also contains 1supplemental data supplied by Cessna Aircraft Company. Section 1 provides basic data and information of general interest. It also contains definitions or explanations of symbols, abbreviations, and terminology commonly used. DESCRIPTIVE DATA ENGINE Number of Engines: 1. Engine Manufacturer: Textron Lycoming. Engine Model Number: I0-360-L2A. Engine Type: Normally aspirated, direct drive, air-cooled, horizontally opposed, fuel injected, four cylinder engine with 360 cu.in.displacement. Horsepower Rating and Engine Speed: 180 rated BHP at 2700 RPM.",184.0
-30,"PROPELLER Propeller Manufacturer: McCauley Propeller Systems. Propeller Model Number: 1A170E/JHA7660. Number of Blades: 2. Propeller Diameter: 76 inches. Propeller Type: Fixed pitch. FUEL j\WARNING USE OF UNAPPROVED FUELS MAY RESULT IN DAMAGE TO THE ENGINE AND FUEL SYSTEM COMPONENTS, RESULTING IN POSSIBLE ENGINE FAILURE. Approved Fuel Grades (and Colors): 1-4 1 OOLL Grade Aviation Fuel (Blue). 100 Grade Aviation Fuel (Green). Revision 4",110.0
-29,"CESSNA MODEL 172S SECTION 1 GENERAL NOTE lsopropyl alcohol or diethylene glycol monomethyl ether (DiEGME) may be added to the fuel supply.  Additive concentrations shall not exceed 1 % for isopropyl alcohol or 0.10% to 0.15% for DiEGME.  Refer to Section 8 for additional information. Fuel Capacity: Total Capacity: 56.0 U.  S. gallons. 53.0 U.  S. gallons. Total Usable: Total Capacity Each Tank: 28.0 U.  S. gallons. Total Usable Each Tank: 26.5 U.  S. gallons. OIL NOTE To ensure maximum fuel capacity and min1m1ze cross- feeding when refueling, always park the airplane in a wings- level, normal ground attitude and place the fuel selector in the Left or Right position. Refer to Figure 1-1 for normal ground attitude dimensions. Oil Specification: MIL-L-6082 or SAE J1966 Aviation Grade Straight Mineral Oil:I Used when the airplane was delivered from the factory and should be used to replenish the supply during the first 25 hours.",234.5
-29,"This oil should be drained and the filter changed after the first 25 hours of operation.  Refill the engine with MIL-L-6082 or SAE J1966 Aviation I Grade Straight Mineral Oil and continue to use until a total of 50 hours has accumulated or oil consumption has stabilized. MIL-L-22851 or SAE J1899 Aviation Grade Ashless Dispersant I Oil: Oil conforming to the latest revision and/or supplements to Textron Lycoming Service Instruction No.1014, must be used after first 50 hours or once oil consumption has stabilized. Revision 4 1-5",133.0
-28,"SECTION 1 GENERAL CESSNA MODEL 172S Recommended Viscosity for Temperature Range: I Temperature MIL-L-6082 MIL-L-22851 or SAE or J1899 SAE J1966 Ashless Dispersant Straight SAE Grade Mineral Oil SAE Grade Above 27°C (80°F) 60 15W-50, 20W-50 or 60 Above 16°C (60°F) 50 40 or 50 -1°c (30°F) to 32°C (90°F) 40 40 -18°C (0°F) to 21°C (70°F) 30 30, 40 or 20W-40 Below -12°C (10°F) 20 30 or 20W-30 -18°C (0°F) to 32°C (90°F) 20W-50 20W-50 or 15W-50 All Temperatures --- 15W-50 or 20W-50 NOTE When operating temperatures overlap, use the lighter grade of oil. Oil Capacity: Sump: 8 U.  S. Quarts I Total: 9 U.  S. Quarts MAXIMUM CERTIFICATED WEIGHTS Ramp Weight Normal Category: Utility Category: Takeoff Weight Normal Category: Utility Category: Landing Weight Normal Category: Utility Category: 1-6 2558 lbs. 2208 lbs. 2550 lbs. 2200 lbs. 2550 lbs. 2200 lbs. Revision 4",215.75
-27,"CESSNA MODEL 172S SECTION 1 GENERAL Weight in Baggage Compartment, Normal Category: Baggage Area 1 (Station 82 to 108): 120 lbs.  See note below. Baggage Area 2 (Station 108 to 142): 50 lbs.  See note below. NOTE The maximum combined weight capacity for Baggage Area 1 and Baggage Area 2 is 120 lbs. Weight in Baggage Compartment, Utility Category: In this category, the rear seat must not be occupied and the baggage compartment must be empty. STANDARD AIRPLANE WEIGHTS Standard Empty Weight: Maximum Useful Load, Normal Category Maximum Useful Load, Utility Category: CABIN AND ENTRY DIMENSIONS 1663 lbs. 895 lbs. 545 lbs. Detailed dimensions of the cabin interior and entry door openings are illustrated in Section 6.",180.0
-27,BAGGAGE SPACE AND ENTRY DIMENSIONS Dimensions of the baggage area and baggage door opening are illustrated in detail in Section 6. SPECIFIC LOADINGS Wing Loading: Power Loading: 14. 7 lbs./sq.ft. 14.2 lbs./hp. I Revision 4 1-7,56.5
-26,"SECTION 1 GENERAL CESSNA MODEL 172S SYMBOLS, ABBREVIATIONS AND TERMINOLOGY GENERAL AIRSPEED TERMINOLOGY AND SYMBOLS KCAS KIAS KTAS Vs Vx Vy Knots Calibrated Airspeed is indicated airspeed corrected for position and instrument error and expressed in knots.  Knots calibrated airspeed is equal to KTAS in standard atmosphere at sea level. Knots Indicated Airspeed is the speed shown on the airspeed indicator and expressed in knots. Knots True Airspeed is the airspeed expressed in knots relative to undisturbed air which is KCAS corrected for altitude and temperature. Maneuvering Speed is the maximum speed at which full or abrupt control movements may be used without overstressing the airframe. Maximum Flap Extended Speed is the highest speed permissible with wing flaps in a prescribed extended position. Maximum Structural Cruising Speed is the speed that should not be exceeded except in smooth air, then only with caution. Never Exceed Speed is the speed limit that may not be exceeded at any time. Stalling Speed or the minimum steady flight speed is the minimum speed at which the airplane is controllable. Stalling Speed or the minimum steady flight speed is the minimum speed at which the airplane is controllable in the landing configuration at the most forward center of gravity.",323.0
-26,Best Angle-of-Climb Speed is the speed which results in the greatest gain of altitude in a given horizontal distance. Best Rate-of-Climb Speed is the speed which results in the greatest gain in altitude in a given time. Revision 4,57.5
-25,CESSNA MODEL 172S SECTION 1 GENERAL METEOROLOGICAL TERMINOLOGY OAT Standard Temperature Outside Air Temperature is the free air static temperature.  It may be expressed in either degrees Celsius or degrees Fahrenheit. Standard Temperature is 15°C at sea level pressure altitude and decreases by 2°C for each 1000 feet of altitude. Pressure Pressure Altitude is the altitude read from an Altitude altimeter when the altimeter's barometric scale has been set to 29.92 inches of mercury (1013 mb). ENGINE POWER TERMINOLOGY BHP RPM Static RPM MAP Lean Mixture Rich Mixture Full Rich Idle Cutoff Revision 4 Brake Horsepower is the power developed by the engine. Revolutions Per Minute is engine speed. Static RPM is engine speed attained during a full throttle engine runup when the airplane is on the ground and stationary. Manifold Absolute Pressure is the absolute pressure measured in the engine induction system. MAP is measured in units of inches of mercury (in HG). Decreased proportion of fuel in the fuel-air mixture supplied to the engine.,261.0
-25,"As air density decreases, the amount of fuel required by the engine decreases for a given throttle setting. Adjusting the fuel-air mixture to provide a smaller portion of fuel is known as ""leaning"" the mixture. Increased proportion of fuel in the fuel-air mixture supplied to the engine.  As air density increases, the amount of fuel required by the engine increases for a given throttle setting.  Adjusting the fuel-air mixture to provide a greater portion of fuel is known as ""richening"" the mixture. Mixture control full forward (pushed in, full control travel, toward the panel). Mixture control full aft (pulled out, full control travel, away from the panel).",166.0
-24,"SECTION 1 GENERAL CESSNA MODEL 172S ENGINE POWER TERMINOLOGY (Continued) Full Throttle Closed Throttle Throttle full forward (pushed in, full control travel, toward the panel) Also known as ""full open"" throttle. Throttle full aft (pulled out, full control travel, away from the panel). Also known as the throttle ""idle"" position. AIRPLANE PERFORMANCE AND FLIGHT PLANNING TERMINOLOGY Demon- strated Crosswind Velocity Usable Fuel Unusable Fuel GPH NMPG g Course Datum 1-10 Demonstrated Crosswind Velocity is the velocity of the crosswind component for which adequate control of the airplane during takeoff and landing was actually demonstrated during certification tests. The value shown is not considered to be limiting. Usable Fuel is the fuel available for flight planning. Unusable Fuel is the quantity of fuel that can not be safely used in flight. Gallons Per Hour is the amount of fuel consumed per hour. Nautical Miles Per Gallon is the distance which can be expected per gallon of fuel consumed at a specific engine power setting and/or flight configuration. g is acceleration due to gravity.",275.0
-24,"Course Datum is the compass reference used by the autopilot, along with course deviation, to provide lateral control when tracking a navigation signal. Revision 4",40.5
-23,"CESSNA MODEL 172S SECTION 1 GENERAL WEIGHT AND BALANCE TERMINOLOGY Reference Datum Station Arm Moment Center of Gravity (C.  G.) C.  G. Arm C.  G. Limits Standard Empty Weight Basic Empty Weight Useful Load MAC July 8/98 Reference Datum is an imaginary vertical plane from which all horizontal distances are measured for balance purposes. Station is a location along the airplane fuselage given in terms of the distance from the reference datum. Arm is the horizontal distance from the reference datum to the center of gravity (C.  G.) of an item. Moment is the product of the weight of an item multiplied by its arm. (Moment divided by the constant 1000 is used in this handbook to simplify balance calculations by reducing the number of digits.) Center of Gravity is the point at which an airplane, or equipment, would balance if suspended.  Its distance from the reference datum is found by dividing the total moment by the total weight of the airplane. Center of Gravity Arm is the arm obtained by adding the airplane's individual moments and dividing the sum by the total weight. Center of Gravity Limits are the extreme center of gravity locations within which the airplane must be operated at a given weight. Standard Empty Weight is the weight of a standard airplane, including unusable fuel, full operating fluids and full engine oil.",335.75
-23,Basic Empty Weight is the standard empty weight plus the weight of optional equipment. Useful Load is the difference between ramp weight and the basic empty weight. MAC {Mean Aerodynamic Chord) is the chord of an imaginary rectangular airfoil having the same pitching moments throughout the flight range as that of the actual wing. 1-11,84.0
-22,"SECTION 1 GENERAL CESSNA MODEL 172S WEIGHT AND BALANCE TERMINOLOGY (Continued) Maximum Ramp Weight Maximum Takeoff Weight Maximum Landing Weight Tare 1-12 Maximum Ramp Weight is the maximum weight approved for ground maneuver, and includes the weight of fuel used for start, taxi and run up. Maximum Takeoff Weight is the maximum weight approved for the start of the takeoff roll. Maximum Landing Weight is the maximum weight approved for the landing touchdown. Tare is the weight of chocks, blocks, stands, etc. used when weighing an airplane, and is included in the scale readings.  Tare is deducted from the scale reading to obtain the actual (net) airplane weight. July 8/98",169.5
-21,"CESSNA MODEL 172S SECTION 1 GENERAL METRIC I IMPERIAL I U.  S. CONVERSION CHARTS The following charts have been provided to help international operators convert U.  S. measurement supplied with the Pilot's Operating Handbook into metric and imperial measurements. The standard followed for measurement units shown, is the National Institute of Standards Technology (NIST), Publication 811, ""Guide for the Use of the International System of Units (SI)."" Please refer to the following pages for these charts. May 30/00 1-13",130.25
-20,SECTION 1 GENERAL CESSNA MODEL 172S (Kilograms x 2.205 = Pounds) (Pounds x .454 =Kilograms) kg 0 lb. 0 10 22.046 20 44.093 30 66.139 40 88.185 50 110.23 60 132.28 70 154.32 80 176.37 90 198.42 100 220.46 lb. 0 kg 0 10 4.536 20 9.072 30 13.608 40 18.144 50 22.680 60 27.216 70 31.752 80 36.287 90 40.823 100 45.359 1-14 1 lb. 2.205 24.251 46.297 68.343 90.390 112.44 134.48 156.53 178.57 200.62 222.67 1 kg 0.454 4.990 9.525 14.061 18.597 23.133 27.669 32.205 36.741 41.277 45.813 KILOGRAMS INTO POUNDS KILOGRAMMES EN LIVRES 2 3 4 5 6 lb. lb. lb. lb. lb. 4.409 6.614 8.819 11.023 13.228 26.456 28.660 30.865 33.069 35.274 48.502 50.706 52.911 55.116 57.320 70.548 72.753 74.957 77.162 79.366 92.594 94.799 97.003 99.208 101.41 114.64 116.85 119.05 121.25 123.46 136.69 138.89 141.10 143.30 145.51 158.73 160.94 163.14 165.35 167.55 180.78 182.98 185.19 187.39 189.60 202.83 205.03 207.24 209.44 211.64 224.87 227.08 229.28 231.49 233.69 POUNDS INTO KILOGRAMS LIVRES EN KILOGRAMMES 2 3 4 5 6 kg kg kg kg kg 0.907 1.361 1.814 2.268 2.722 5.443 5.897 6.350 6.804 7.257 9.979 10.433 10.886 11.340 11.793 14.515 14.969 15.422 15.876 16.329 19.051 19.504 19.958 20.412 20.865 23.587 24.040 24.494 24.948 25.401 28.123 28.576 29.030 29.484 29.937 32.659 33.112 33.566 34.019 34.473 37.195 37.648 38.102 38.555 39.009 41.731 42.184 42.638 43.091 43.545 46.266 46.720 47.174 47.627 48.081 7 8 9 lb. lb.,348.0
-20,lb. 15.432 17.637 19.842 37.479 39.683 41.888 59.525 61.729 63.934 81.571 83.776 85.980 103.62 105.82 108.03 125.66 127.87 130.07 147.71 149.91 152.12 169.76 171.96 174.17 191.80 194.01 196.21 213.85 216.05 218.26 235.90 238.10 240.30 7 8 9 kg kg kg 3.175 3.629 4.082 7.711 8.165 8.618 12.247 12.701 13.154 16.783 17.237 17.690 21.319 21.772 22.226 25.855 26.303 26.762 30.391 30.844 31.298 34.927 35.380 35.834 39.463 39.916 40.370 43.999 44.452 44.906 48.534 48.988 49.442 Figure 1-2.  Weight Conversions (Sheet 1 of 2) July 8/98,132.75
-19,"CESSNA MODEL 172S SECTION 1 GENERAL (Kilograms x 2.205 = Pounds) (Pounds x .454 = Kilograms) Revision 4 POUNDS KILOGRAMS 220 -..,----1 00 210 95 200 90 190 85 180 80 170 75 160 70 150 140 65 130 60 120 55 110 50 100 45 90 40 80 35 70 30 60 25 50 40 20 30 15 20 10 10 5 0 0 Units x 10, 100, etc. Figure 1-2 .  Weight Conversions (Sheet 2) 0585T1021 1-15",88.0
-18,SECTION 1 GENERAL m 0 feet 0 - - - 10 32.808 20 65.617 30 98.425 40 131.23 50 164.04 60 195.85 70 229.66 80 262.47 90 295.27 100 328.08 ft 0 m 0 --- 10 3.048 20 6.096 30 9.144 40 12.192 50 15.240 60 18.288 70 21.336 80 24.384 90 27.432 100 30.480 1-16 CESSNA MODEL 172S (Meters x 3.281 = Feet) (Feet x .305 = Meters) 1 2 feet feet 3.281 6.562 36.089 39.370 68.897 72.178 101.71 104.99 134.51 137.79 167.32 170.60 200.13 203.41 232.94 236.22 265.75 269.03 298.56 301.84 331.36 334.64 1 2 m m 0.305 0.610 3.353 3.658 6.401 6.706 9.449 9.754 12.497 12.802 15.545 15.850 18.593 18.898 21.641 21.946 24.689 24.994 27.737 28.042 30.785 31.090 METERS INTO FEET METRES EN PIEDS 3 4 5 feet feet feet 9.842 13.123 16.404 42.651 45.932 49.212 75.459 78.740 82.021 108.27 111.55 114.83 141.08 144.36 147.64 173.86 177.16 180.45 206.69 209.97 213.25 239.50 242.78 246.06 272.31 275.59 278.87 305.12 308.40 311.68 337.93 341.21 344.49 FEET INTO METERS PIEDS EN METRES 3 4 5 m m m 0.914 1.219 1.524 3.962 4.267 4.572 7.010 7.315 7.620 10.058 10.363 10.668 13.106 13.411 13.716 16.154 16.459 16.754 19.202 19.507 19.812 22.250 22.555 22.860 25.298 25.603 25.908 28.346 28.651 28.956 31.394 31.699 32.004 6 7 8 9 feet feet feet feet 19.685 22.956 26.247 29.528 52.493 55.774 59.055 62.336 85.302 88.582 91.863 95.144 118.11 121.39 124.67 127.95 150.92 154.20 157.48 160.76 183.73 187.01 190.29 193.57 216.53 219.82 223.10 226.38 249.34 252.62 255.90 259.19 282.15 285.43 288.71 291.58 314.96 318.24 321.52 324.80 347.77 351.05 354.33 357.61 6 7 8 9 m m m m 1.829 2.134 2.438 2.743 4.877 5.182 5.486 5.791 7.925 8.230 8.534 8.839 10.973 11.278 11.582 11.887 14.021 14.326 14.630 14.935 17.069 17.374 17.678 17.983 20.117 20.422 20.726 21.031 23.165 23.470 23.774 24.079 26.213 26.518 26.822 27.127 29.261 29.566 29.870 30.175 32.309 32.614 32.918 33.223 Figure 1-3.  Length Conversions (Sheet 1 of 2) May 30/00,473.0
-17,"CESSNA MODEL 172S (Meters x 3.281 = Feet) FEET 320 300 280 260 240 220 200 180 160 140 120 100 80 60 40 20 0 SECTION 1 GENERAL (Feet x .305 = Meters) METERS 100 95 90 85 80 75 70 65 60 55 50 45 40 35 30 25 20 15 10 5 0 Units x 10, 100, etc. Figure 1-3 .  Length Conversions (Sheet 2) I Revision 4 1-17",75.25
-16,SECTION 1 GENERAL CESSNA MODEL 172S (Centimeters x .394 = Inches) (Inches x 2.54 = Centimeters) cm 0 in. 0 --- 10 3.937 20 7.874 30 11.811 40 15.748 50 19.685 60 23.622 70 27.559 80 31.496 90 35.433 100 39.370 in. 0 cm 0 --- 10 25.40 20 50.80 30 76.20 40 101.60 50 127.00 60 152.40 70 177.80 80 203.20 90 228.60 100 254.00 1-18 1 in. 0.394 4.331 8.268 12.205 16.142 20.079 24.016 27.953 31.890 35.827 39.764 1 cm 2.54 27.94 53.34 78.74 104.14 129.54 154.94 180.34 205.74 231.14 256.54 CENTIMETERS INTO INCHES CENTIMETRES EN POLICES 2 3 4 5 6 in. in. in. in. in. 0.787 1.181 1.575 1.969 2.362 4.724 5.118 5.512 5.906 6.299 8.661 9.055 9.449 9.843 10.236 12.598 12.992 13.386 13.780 14.173 16.535 16.929 17.323 17.717 18.110 20.472 20.866 21.260 21.654 22.047 24.409 24.803 25.197 25.591 25.984 28.346 28.740 29.134 29.528 29.921 32.283 32.677 33.071 33.465 33.858 36.220 36.614 37.008 37.402 37.795 40.157 40.551 40.945 41.339 41.732 INCHES INTO CENTIMETERS POLICES EN CENTIMETRES 2 3 4 5 6 cm cm cm cm cm 5.08 7.62 10.16 12.70 15.24 30.48 33.02 35.56 38.10 40.64 55.88 58.42 60.96 63.50 66.04 81.28 83.82 86.36 88.90 91.44 106.68 109.22 111.76 114.30 116.84 132.08 134.62 137.16 139.70 142.24 157.48 160.02 162.56 165.10 167.64 182.88 185.42 187.96 190.50 193.04 208.28 210.82 213.36 215.90 218.44 233.68 236.22 238.76 241.30 243.84 259.08 261.62 264.16 266.70 269.24 7 8 9 in. in.,345.25
-16,in. 2.756 3.150 3.543 6.693 7.087 7.480 10.630 11.024 11.417 14.567 14.961 15.354 18.504 18.898 19.291 22.441 22.835 23.228 26.378 26.772 27.164 30.315 30.709 31.102 34.252 34.646 35.039 38.189 38.583 38.976 42.126 42.520 42.913 7 8 9 cm cm cm 17.78 20.32 22.96 43.18 45.72 48.26 68.58 71.12 73.66 93.98 96.52 99.06 119.38 121.92 124.46 144.78 147.32 149.86 170.18 172.72 175.26 195.58 198.12 200.66 220.98 223.52 226.06 246.38 248.92 251.46 271.78 274.32 276.86 Figure 1-4.  Length Conversions (Sheet 1 of 2) May 30/00,129.75
