page_number,sentence_chunk,chunk_token_count
203,"A Textron Company Pilot's Operating Handbook and FAA Approved Airplane Flight Manual CESSNA MODEL 172S AIRPLANES 17258001 AND ON SUPPLEMENT 1 BENDIX/KING KX 155A VHF NAV/COMM with Kl 208 or Kl 209A INDICATOR HEAD SERIAL NO. _______ _ REGISTRATION NO. _____ _ This supplement must be inserted into Section 9 of the Pilot's Operating Handbook and FAA Approved Airplane Flight Manual. FAA APPROVAL 'AAAPPROVEDUNDERFAR21SUBPARTJ The Cessna Aircraft Co _ ~atio_n Option Manutac:turer CE·1 7~.  I~ ExecutiveEn9111H1 D~t:-J:~la. 1998 f) Member of GAMA COPYRIGHT © 1998 CESSNA AIRCRAFT COMPANY WICHITA, KANSAS, USA 172SPHUS·S1·00 8 July 1998 81-1",159.5
204,"SECTION 9 - SUPPLEMENTS SUPPLEMENT 1 - FAA APPROVED CESSNA MODEL 172S SUPPLEMENT 1 BENDIX/KING KX 155A VHF NAV/COMM with Kl 208 or Kl 209A INDICATOR HEAD The following Log of Effective Pages provides the date of issue for original and revised pages, as well as a listing of all pages in the Supplement.  Pages which are affected by the current revision will carry the date of that revision Revision Level Date of Issue 0 (Original) July 8, 1998 LOG OF EFFECTIVITY PAGES PAGE Title (S1-1) S1-2 S1-3 S1-4 S1-5 S1-6 S1-7 S1-8 DATE July 8/98 July 8/98 July 8/98 July 8/98 July 8/98 July 8/98 July 8/98 July 8/98 PAGE S1-9 S1-10 S1 -11 S1-12 S1-13 S1-14 S1-15 S1-16 Blank DATE July 8/98 July 8/98 July 8/98 July 8/98 July 8/98 July 8/98 July 8/98 July 8/98 SERVICE BULLETIN CONFIGURATION LIST The following is a list of Service Bulletins that are applicable to the operation of the airplane, and have been incorporated into this supplement.  This list contains only those Service Bulletins that are currently active. Airplane Unit Revision Incorporated Number Title Effectivity Incorporation In Airplane S1-2 July 8/98",278.25
205,"CESSNA MODEL 172S SECTION 9 - SUPPLEMENTS SUPPLEMENT 1 - FAA APPROVED SUPPLEMENT BENDIX/KING KX 155A VHF NAV/COMM with Kl 208 or Kl 209A INDICATOR HEAD SECTION 1 GENERAL The Bendix/King KX 155A VHF Nav/Comm, shown in Figure 1, consists of a panel-mounted receiver-transmitter and a Kl 208 or Kl 209A Indicator. The set includes a 760-channel VHF communications receiver- transmitter and a 200-channel VHF navigation receiver. A 40- channel glide- slope receiver is also included if the Kl 209A indicator is used.  The communications receiver-transmitter receives and transmits signals between 118.00 and 136.975 MHz with 25- kHz spacing.  Optional 8.33 kHz (2280 channel) Comm is available. The navigation receiver receives VOR and localizer signals between 108.00 and 117.95 MHz in 50-kHz steps.  The glide slope receiver is automatically tuned when a localizer frequency is selected.  The circuits required to interpret the VOR and localizer signals are also an integral part of the Nav receiver. Large self-dimming gas discharge readouts display both the communications and navigation operating frequencies. The KX- 155A's ""flip-flop"" preselect feature enables you to store one frequency in the standby display while operating on another and then interchange them instantly with the touch of a button.",326.0
205,"Both the active (COMM) and the standby (STBY) frequencies may be displayed at all times and are stored in nonvolatile memory without drain on the aircraft battery.  KX 155A has 32 programmable comm channels, a stuck microphone alert and transmitter shutdown, Bearing To/From radial mode, course deviation indicator mode and an elapsed timer mode. July 8/98 S1-3",90.25
206,"SECTION 9 - SUPPLEMENTS SUPPLEMENT 1 - FAA APPROVED CESSNA MODEL 172S The Comm portion incorporates an automatic squelch. To override the automatic squelch, the Comm volume control knob is pulled out. Push the knob back in to reactivate the automatic squelch. A ""T"" will be displayed during transmit and ""R"" during valid signal reception. The Nav portion uses the pull out feature of the Nav volume control to receive the Nav signal ldent. Pull the volume control knob out to hear the ldent signal plus voice.  Push the knob in to attenuate the ldent signal and still hear Nav voice. All controls for the Nav/Comm, except those for navigation course selection, are mounted on the front panel of the receiver- transmitter. Control lighting is provided by NAV/COMM interior lighting and the instrument panel flood lighting system.  Operation and description of the audio selector panel used in conjunction with this radio is shown and described in Supplement 3 in this section.",243.75
206,"S1-4 NOTE The unit has a stuck microphone alert feature.  If the microphone is keyed continuously for greater than 33 seconds, the transmitter stops transmitting and the active Comm frequency flashes to alert the pilot of the stuck mic condition. July 8/98",64.0
207,CESSNA MODEL 172S SECTION 9 - SUPPLEMENTS SUPPLEMENT 1 - FAA APPROVED 2 3 KX 1 /22.1 3.00 I I 11.bO 3g:sti ET KX 155A VHF NAV/COMM • TO INDICATION 8 FROM INDICATION @ FLAG INDICATION 18 Kl 208 INDICATOR HEAD 8 NAV STBY 4 5 PULL OBS 7 6 Kl 209A INDICATOR 0585C1045 0585C1046 0585C1047 Figure 1.  Bendix/King KX 155A VHF NAV/COMM with Kl 208 or Kl 209A Indicator Head (Sheet 1 of 7) July 8/98 S1-5,98.75
208,"SECTION 9 - SUPPLEMENTS SUPPLEMENT 1 - FAA APPROVED CESSNA MODEL 172S NAV FUNCTION DISPLAYS ( 1og.  Eo ~ 0::10 J - + -- -- __ /\ __ -- -- -- VOR MODE: ACTIVE/BEARING, CDI FORMAT ( VOR MODE: ACTIVE/BEARING, FLAG DISPLAY ( 109.50 030'0] VOR MODE: ACTIVE ""BEARING TO"" FUNCTION DISPLAY ( _TO) VOR MODE: ACTIVE/BEARING, FLAG DISPLAY ( 110.90 LDC ) - ~- -- -- --><-- -- -- -- LOCALIZER MODE: FREQUENCY/COi FORMAT Figure 1 .  Bendix/King KX 155A VHF NAV /COMM with Kl 208 or Kl 209A Indicator Head (Sheet 2 of 7) S1-6 July 8/98",130.0
209,"CESSNA MODEL 172S SECTION 9 - SUPPLEMENTS SUPPLEMENT 1 - FAA APPROVED 1.  OPERATING COMM FREQUENCY DISPLAY -- Displays COMM ACTIVE and COMM STANDBY frequencies with a ""T"" between them to indicate TRANSMIT and an ""R"" to indicate RECEIVE modes of operation. 2.  OPERATING NAV FREQUENCY DISPLAY -- The right portion of the display is allocated to NAV receiver ACTIVE and STANDBY information.  The frequency channeling is similar to the COMM when operating in the frequency mode.  The NAV ACTIVE and STANDBY frequencies are stored in the memory on power down and return on power up. 3.  NAV STANDBY/OBS/Bearing/Radial/Timer Display -- The right side of the NAV display is controlled by the MODE SELECTOR BUTTON (see #7 below). With an active VOR frequency, this portion of the display shows the ST AND BY frequency, OBS setting for the internal CDI, the bearing to the VOR station, radial from the VOR station, or a count-up/count- down timer.  With an active localizer frequency, this portion of the display shows the standby frequency, the letters ""LOC"", or count-up/count-down timer.",270.5
209,4.  NAV FREQUENCY SELECTOR KNOB (SMALL) -- Operates in 50 kHz steps. The NAV receiver's lower and upper frequency limits are 108.00 MHz and 117.95 MHz.  Exceeding the upper limit of frequency band will automatically return to the lower limit and vice versa.  A clockwise rotation will increase (inc) the previous frequency while a counterclockwise rotation will decrease (dee) the previous frequency. 5.  NAV FREQUENCY SELECTOR KNOB (LARGE) -- Operates in 1 MHz steps.  The frequency inc/dee operates the STANDBY frequency display. A clockwise rotation will increase the previous frequency while a counterclockwise rotation will decrease the previous frequency.  Exceeding the upper limit of the frequency band will automatically return to the lower limit and vice versa.,192.75
209,Figure 1.  Bendix/King KX 155A VHF NAV/COMM with Kl 208 or Kl 209A Indicator Head (Sheet 3 of 7) July 8/98 S1-7,27.75
210,"SECTION 9 - SUPPLEMENTS SUPPLEMENT 1 - FAA APPROVED CESSNA MODEL 172S 6.  NAV/FREQUENCY TRANSFER BUTTON ( II( • ) -- Interchanges the NAV Active and STANDBY frequencies. Depressing the NAV frequency transfer button for 2 seconds or more will cause the display to go into the ACTIVE ENTRY mode.  Only the ACTIVE frequency will be displayed and it can be directly changed by using the NAV inc/dee knobs. The display will return to the ACTIVE/STANDBY mode when the NA V frequency transfer button is pushed. 7.  MODE SELECTOR BUTTON -- Depressing the mode button will cause the NAV display to go from the ACTIVE/STANDBY format to the ACTIVE/COi (Course Deviation Indicator) format. In the CDI mode, the frequency inc/dee knob (pushed in) channels the ACTIVE frequency.  When the ACTIVE window is tuned to a VOR frequency, the standby frequency area is replaced by a three digit OBS (Omni Bearing Selector) display.  The desired OBS course can be selected by pulling out the inner NAV frequency knob and turning it.",252.5
210,"This OBS display is independent of any OBS course selected on an external CDI.  An ""OBS"" in the middle of the NAV display will flash while the inner NAV frequency knob is pulled out.  The CDI is displayed on the line below the frequency/OBS.  When the ACTIVE window is tuned to a localizer frequency, the standby frequency area is replaced by ""LOC"". When the received signal is too weak to ensure accuracy the display will ""FLAG"". Depressing the mode button again will cause the NAV display to go from the ACTIVE/COi format to the ACTIVE/BEARING format.  In the BEARING mode, the frequency inc/dee knob channels the ACTIVE frequency window. Depressing the frequency transfer button will cause the ACTIVE frequency to be placed in blind storage and the STANDBY frequency (in blind storage) to be displayed in the ACTIVE window display. In bearing mode, the right hand window of the NAV display shows the bearing TO the station.  When a too weak or invalid VOR signal is received the display flags (dashes).",251.25
210,Figure 1.  Bendix/King KX 155A VHF NAV/COMM with Kl 208 or Kl 209A Indicator Head (Sheet 4 of 7) S1-8 July 8/98,27.75
211,"CESSNA MODEL 172S SECTION 9 - SUPPLEMENTS SUPPLEMENT 1 - FAA APPROVED Another push of the mode button will cause the NAV display to go from the ACTIVE/BEARING format to the ACTIVE/RADIAL format.  In the RADIAL mode, the frequency inc/dee knobs channel the ACTIVE frequency window and depressing the frequency transfer button will cause the ACTIVE frequency to be placed in blind storage and the STANDBY frequency (in blind storage) to be displayed in the ACTIVE window display.  In radial mode of operation, the right hand window of NAV display shows the radial FROM the station.  When a too weak or invalid VOR signal is received the display flags (dashes). Another push of the mode button will cause the unit to go into the TIMER mode. When the unit is turned on, the elapsed timer (ET) begins counting upwards from zero.  The timer can be stopped and reset to zero by pushing the NAV frequency transfer button for 2 seconds or more causing the ET on the display to flash. In this state, the timer can be set as a countdown timer or the elapsed timer can be restarted.  The countdown timer is set by using the NAV frequency inc/dee knobs to set the desired time and then pushing the NAV frequency transfer button to start the timer.  The large knob selects minutes, the small knob in the ""in"" position selects 10 second intervals, and the small knob in the ""out"" position selects individual seconds.",350.25
211,"After the countdown timer reaches zero, the counter will begin to count upwards indefinitely while flashing for the first 15 seconds.  When the elapsed timer is reset to zero it may be restarted again by momentarily pushing the NAV frequency transfer button. 8.  NAV/VOLUME CONTROL (PULL IDENT) -- Adjusts volume of navigation receiver audio. When the knob is pulled out, the ldent signal plus voice may be heard.  The volume of voice/ident can be adjusted by turning this knob. Figure 1.  Bendix/King KX 155A VHF NAV/COMM with Kl 208 or Kl 209A Indicator Head (Sheet 5 of 7) July 8/98 S1-9",147.5
212,"SECTION 9 - SUPPLEMENTS SUPPLEMENT 1 - FAA APPROVED CESSNA MODEL 172S 9.  COMM FREQUENCY SELECTOR KNOB (INNER) -- This smaller knob is designed to change the indicated frequency in steps of 50-kHz when it is pushed in, and in 25-kHz steps when it is pulled out. For 8.33 kHz versions, channels are incremented in 25 kHz steps with the knob pushed in and 8.33 kHz with the knob pulled out. 10.  COMM FREQUENCY SELECTOR KNOB (OUTER) -- The outer, larger selector knob is used to change the MHz portion of the frequency display.  At either band-edge of the 118-136 MHz frequency spectrum, an offscale rotation will wrap the display around to the other frequency band-edge (i.e., 136 MHz advances to 118 MHz). 11.  CHANNEL BUTTON -- Pressing the CHAN button for 2 or more seconds will cause the unit to enter the channel program (PG) mode.  Upon entering the channel program mode, the channel number will flash indicating that it can be programmed.  The desired channel can be selected by turning the comm kHz knob.",252.75
212,"The channel frequency can be entered by pushing the comm transfer button which will cause the standby frequency to flash.  The comm frequency knobs are then used to enter the desired frequency.  If dashes (located between 136 MHz and 118 MHz) are entered instead of a frequency, the corresponding channel is skipped in channel selection mode.  Additional channels may be programmed by pressing the COMM transfer button and using the same procedure.  The channel information is saved by pushing the CHAN button which will also cause the unit to return to the previous frequency entry mode. The channel selection mode (CH) can then be entered by momentarily pushing the CHAN button.  The comm frequency knobs can be used to select the desired channel.  The unit will automatically default to the previous mode if no channel is selected within 2 seconds after entering the channel selection mode.  The unit is placed in the transmit mode by depressing a mic button. Figure 1.",243.0
212,Bendix/King KX 155A VHF NAV/COMM with Kl 208 or Kl 209A Indicator Head (Sheet 6 of 7) S1-10 July 8/98,25.25
213,"CESSNA MODEL 172S SECTION 9 - SUPPLEMENTS SUPPLEMENT 1 - FAA APPROVED 12.  COMM FREQUENCY TRANSFER BUTTON ( iE _. ) -- Interchanges the frequencies in the USE and STANDBY displays.  To tune the radio to the desired operating frequency, the desired frequency must be entered into the standby display and then the transfer button must be pushed.  This will trade the contents of the active and standby displays.  The operating frequency can also be entered by accessing the ACTIVE ENTRY (direct tune) mode which is done by pushing the COMM TRANSFER button for 2 or more seconds.  In the direct tune mode, only the active part of the display is visible. The desired frequency can be directly entered into the display. Push the COMM TRANSFER button again to return to the active/standby display. The transceiver is always tuned to the frequency appearing in the ACTIVE display.",218.25
213,"It is, therefore, possible to have two different frequencies stored in the ACTIVE and STANDBY displays and to change back and forth between them at the simple push of the transfer button. 13.  COMM VOLUME CONTROL (OFF/PULUTEST) -- Rotate the VOL knob clockwise from the OFF position.  Pull the VOL knob out and adjust for desired listening level.  Push the VOL knob back in to actuate the automatic squelch.  The VOL knob may also be pulled out to hear particularly weak signals. 14.  VOR/Localizer Needle or CDI needle. 15.  Glideslope Flag 16.",136.25
213,TO-FROM-NAV FLAG 17.  Azimuth Card 18.  OBS Knob 19.  Glideslope Needle Figure 1.  Bendix/King KX 155A VHF NAV/COMM with Kl 208 or Kl 209A Indicator Head (Sheet 7 of 7) July 8/98 S1-11,46.0
214,"SECTION 9 - SUPPLEMENTS SUPPLEMENT 1 - FAA APPROVED SECTION 2 LIMITATIONS CESSNA MODEL 172S There is no change to the airplane limitations when this avionic equipment is installed. SECTION 3 EMERGENCY PROCEDURES There is no change to the airplane emergency procedures when this avionic equipment is installed. However, if the frequency readouts fail, the radio will remain operational on the last frequency selected. If either frequency transfer button is pressed and held while power is applied to the unit, the unit wakes up with 120.00 MHz in the COMM use frequency and 110.00 MHz in the NAV active frequency, with both COMM and NAV in the active entry mode.  This will aid the pilot in blind tuning the radio. SECTION 4 NORMAL PROCEDURES COMMUNICATION RECEIVER-TRANSMITTER OPERATION: 1.  OFF/PULUTEST Volume Control -- Turn clockwise; pull out and adjust to desired audio level; push control back in to activate the automatic squelch. 2.  MIC Selector Switch (on audio control panel) -- SET to COMM 1. 3.",252.0
214,SPEAKER Selector (on audio control panel) -- SET to desired mode. 4.  COMM Frequency Selector Knobs -- Select desired operating frequency. 5.  COMM Transfer Button -- PRESS to transfer desired frequency from the STBY display into the COMM display. S1-12 July 8/98,65.75
215,"CESSNA MODEL 172S SECTION 9 - SUPPLEMENTS SUPPLEMENT 1 - FAA APPROVED 6.  Mic Button: a. To transmit -- Press button and speak in microphone. NOTE During COMM transmission, a lighted ""T"" will appear between the ""COMM"" and ""STBY"" displays to indicate that the transceiver is operating in the transmit mode. b. To Receive -- RELEASE mike button. NAVIGATION RECEIVER OPERATION: 1.  NAV Frequency Selector Knobs -- SELECT desired operating frequency in ""STBY"" display. 2.  NAV TRANSFER BUTTON -- PRESS to transfer desired frequency from the ""STBY"" display into the ""NAV"" display. 3.  Speaker Selector {on audio control panel) -- SET to desired mode .. 4.",162.5
215,"NAV Volume Control -- a. ADJUST to desired audio level. b. PULL out to identify station. VOR OPERATION: Channel the NAV Receiver to the desired VOR and monitor the audio to positively identify the station. To select an OBS course, turn the OBS knob to set the desired course under the lubber line. When a signal is received, the NAV flag will pull out of view and show a ""TO"" or ""FROM"" flag as appropriate for the selected course. LOC OPERATION Localizer circuitry is energized when the NAV Receiver is channeled to an ILS frequency. Monitor the LOC audio and positively identify the station.  The NAV flag will be out of view when the signal is of sufficient strength to be usable. July 8/98 S1-13",174.5
216,"SECTION 9 - SUPPLEMENTS SUPPLEMENT 1 - FAA APPROVED GLIDESLOPE OPERATION CESSNA MODEL 172S The glideslope receiver is automatically channeled when a localizer frequency is selected.  A separate warning flag is provided to indicate usable signal conditions. PILOT CONFIGURATION This mode can be accessed by pressing and holding the NAV Mode Button for more than 2 seconds and then pressing the Nav Frequency Transfer Button for an additional 2 seconds, while continuing to hold the NAV Mode Button. When the Pilot Config Mode is entered the unit will show the ""SWRV"" mnemonic which is the unit software revision level.  Adjustment pages can be accessed by MODE button presses. The pilot may adjust two parameters in the pilot configuration, the display minimum brightness and sidetone volume level. Minimum Brightness (BRIM) will have a range of 0-255.  The dimmest is 0 and the brightest is 255.  Sidetone volume level is adjusted when SIDE is displayed.  Values from 0-255 may be selected with 0 being least volume, 255 being the greatest.",260.0
216,Adjustment Mnemonic Min Level Max Level Software Revision Number SWRV - - - - - - Minimum Display Brightness BRIM 0 255 Sidetone Level SIDE 0 255 S1-14 July 8/98,40.25
217,"CESSNA MODEL 172S SECTION 9 - SUPPLEMENTS SUPPLEMENT 1 - FAA APPROVED Subsequent presses of the MODE button sequences through SWRV, BRIM, SIDE, and then back to SWRV. Pressing the NAV Transfer Button momentarily exits Pilot configuration mode.  The NAV returns to its pre-Pilot Config state with the new brightness and sidetone levels stored in nonvolatile memory. SECTION 5 PERFORMANCE There is no change to the airplane performance when this avionic equipment is installed. However, the installation of an externally mounted antenna, or several related antennas, may result in a minor reduction in cruise performance. July 8/98 S1-15/(S1-16 Blank)",162.25
219,"A Textron Company Pilot's Operating Handbook and FAA Approved Airplane Flight Manual CESSNA MODEL 172S AIRPLANES 17258001 AND ON SUPPLEMENT 2 BENDIX/KING KT 76C TRANSPONDER WITH BLIND ENCODER SERIAL NO. _______ _ REGISTRATION NO. _____ _ This supplement must be inserted into Section 9 of the Pilot's Operating Handbook and FAA Approved Airplane Flight Manual. FAA APPROVAL 'AAAPPROveOUNDERFAR21SUBPARTJ The Cessna Aircraft Co _~at~ Option Manufac:turer CE·1 ?'~~~ ExecutiYt Enttllffl D~t:-J:;/ra, 1998 f) Member of GAMA COPYRIGHT © 1998 CESSNA AIRCRAFT COMPANY WICHITA, KANSAS, USA 172SPHUS·S2·00 8 July 1998 82-1",153.5
220,"SECTION 9 - SUPPLEMENTS SUPPLEMENT 2 - FAA APPROVED SUPPLEMENT 2 CESSNA MODEL 172S BENDIX/KING KT 76C TRANSPONDER with BLIND ENCODER The following Log of Effective Pages provides the date of issue for original and revised pages, as well as a listing of all pages in the Supplement.  Pages which are affected by the current revision will carry the date of that revision Revision Level Date of Issue 0 (Original) July 8, 1998 LOG OF EFFECTIVITY PAGES PAGE DATE PAGE DATE Title (S2-1) July 8/98 S2-6 July 8/98 S2-2 July 8/98 S2-7 July 8/98 S2-3 July 8/98 S2-8 July 8/98 S2-4 July 8/98 S2-9 July 8/98 S2-5 July 8/98 S2-10 Blank July 8/98 SERVICE BULLETIN CONFIGURATION LIST The following is a list of Service Bulletins that are applicable to the operation of the airplane, and have been incorporated into this supplement.  This list contains only those Service Bulletins that are currently active. Airplane Unit Revision Incorporated Number Title Effectivity Incorporation In Airplane S2-2 July 8/98",248.75
221,"CESSNA MODEL 172S SECTION 9 - SUPPLEMENTS SUPPLEMENT 2 - FAA APPROVED SUPPLEMENT BENDIX/KING KT 76C TRANPONDER with BLIND ENCODER SECTION 1 GENERAL The Bendix/King Transponder (Type KT 76C), shown in Figure 1, is the airborne component of an Air Traffic Control Radar Beacon System (ATCRBS). The transponder enables the ATC ground controller to ""see"" and identify more readily the aircraft on the radarscope.  The blind encoder (SSD120-20) (also shown in Figure 1) enables the transponder to automatically report aircraft altitude to ATC. The Bendix/King Transponder system consists of a panel- mounted unit and an externally-mounted antenna.  The transponder receives interrogating pulse signals on 1030 MHz and transmits coded pulse-train reply signals on 1090 MHz. It is capable of replying to Mode A (aircraft identification) and also to Mode C (altitude reporting) interrogations on a selective reply basis on any of 4096 information code selections. When a panel-mounted SSD120-20 Blind Encoder (not part of KT 76C Transponder system) is included in the avionic configuration, the transponder can provide altitude reporting in 100-foot increments between -1000 and +20,000 feet. The KT 76C features microprocessor and LSI (Large Scale Integrated) control.  Mode and code selection are performed using the rotary knob and numeric buttons and all functions including the flight level altitude are presented on a gas discharge display. All display segments are automatically dimmed by a photocell type sensor.",378.0
222,"SECTION 9 - SUPPLEMENTS SUPPLEMENT 2 - FAA APPROVED CESSNA MODEL 172S A VFR programming sequence, described in Section 4, allows the pilot to preprogram any single code such as ""1200"" into the KT 76C. Pressing the VFR button instantly returns the KT 76C to the preprogrammed code without having to manually enter ""1200"". All Bendix/King Transponder operating controls are located on the front panel of the unit. Functions of the operating controls are described in Figure 1. S2-4 July 8/98",122.25
223,"CESSNA MODEL 172S FL 2 Ob5 8 3 ALT SECTION 9 - SUPPLEMENTS SUPPLEMENT 2 - FAA APPROVED 4 5 R 1200 7 6 1.  IDENT BUTTON (IDT) - When depressed, selects special identifier pulse to be transmitted with transponder reply to effect immediate identification of the airplane on the ground controller's display. (""R"" will illuminate steadily for approximately 18 seconds.  Button illumination is controlled by the avionic light dimming rheostat. 2.  ALTITUDE DISPLAY - Displays the pressure altitude on the left side of the display. The display is in hundreds of feet. ""FL"" is annunciated to indicate Flight Level altitude. Flight Level is a term to indicate that the altitude is not true altitude, but barometric altitude which is not corrected for local pressure. For Example, ""FL-040"" corresponds to an altitude of 4000 feet, meaning sea level pressure of 29.92 inches of mercury.",218.75
223,"The Flight Level altitude is only displayed when the altitude reporting is enabled, i.e. in Altitude mode.  If an invalid code from the altimeter is detected dashes will appear in the altitude window. Altitude reporting is disabled if the altitude window is blank or has dashes. Figure 1.  Bendix/King KT 76C Transponder with Blind Encoder (Sheet 1 of 2) July 8/98 S2-5",92.25
224,"SECTION 9 - SUPPLEMENTS SUPPLEMENT 2 - FAA APPROVED CESSNA MODEL 172S 3.  MODE ANNUNCIATORS - Displays the operating mode of the transponder. 4.  REPLY INDICATOR (R) - ""R"" is illuminated momentarily when the transponder is replying to a valid interrogation and during the 18 ±2 seconds following the initiation of an ldent. 5.  MODE SELECTOR KNOB - Controls application of power and selects transponder operating mode as follows: OFF - Turns set off. SBY - Turns set on for standby power and code selection. ""SBY"" is annunciated. TST - Self-test function.  The transmitter is disabled.",146.25
