page_number,sentence_chunk,chunk_token_count
315,"A Textron Company Pilot's Operating Handbook and FAA Approved Airplane Flight Manual CESSNA MODEL 172S AIRPLANES 17258001 AND ON SUPPLEMENT12 CANADIAN SUPPLEMENT SERIAL NO. _______ _ REGISTRATION NO. ______ _ This supplement must be inserted into Section 9 of the Pilot's Operating Handbook and FAA Approved Airplane Flight Manual when used for Canadian Operation. FAA APPROVAL lfAA Al'PROVEO UNDER FAR 21 SUBPART J The Cessna Aircraft Co _ ~alK>rl Option Manufacturer CE·1 7~'1~ ExecutiYeEnam•r D~t::-~u~i'1o.1998 f) Member of GAMA COPYRIGHT © 1998 CESSNA AIRCRAFT COMPANY WICHITA, KANSAS, USA 172SPHUS·S12·00 8 July 1998 812-1",157.0
316,"SECTION 9 - SUPPLEMENTS SUPPLEMENT 12 - FAA APPROVED SUPPLEMENT12 CANADIAN SUPPLEMENT CESSNA MODEL 172S The following Log of Effective Pages provides the date of issue for original and revised pages, as well as a listing of all pages in the Supplement.  Pages which are affected by the current revision will carry the date of that revision Revision Level Date of Issue 0 (Original) July 8, 1998 LOG OF EFFECTIVITY PAGES PAGE Title (S12-1) S12-2 DATE July 8/98 July 8/98 PAGE S12-3 S12-4 DATE July 8/98 July 8/98 SERVICE BULLETIN CONFIGURATION LIST The following is a list of Service Bulletins that are applicable to the operation of the airplane, and have been incorporated into this supplement.  This list contains only those Service Bulletins that are currently active. Airplane Unit Revision Incorporated Number Title Effectivity Incorporation In Airplane S12-2 July 8/98",218.5
317,CESSNA MODEL 172S SECTION 9 - SUPPLEMENTS SUPPLEMENT 12 - FAA APPROVED SUPPLEMENT CANADIAN SUPPLEMENT SECTION 1 GENERAL This supplement is required for Canadian operation of Cessna Model 172S. SECTION 2 LIMITATIONS The following placard must be installed. 1.  Near the fuel tank filler cap: July 8/98 FUEL 100LU 100 MIN.  GRADE AVIATION GASOLINE CAP.26.5 U.  S. GAL. (100 LITRES) USABLE CAP 17.5 U.  S. GAL. (66 LITRES) USABLE TO BOTTOM OF FILLER INDICATOR TAB S12-3,116.5
318,SECTION 9 - SUPPLEMENTS SUPPLEMENT 12 - FAA APPROVED SECTION 3 EMERGENCY PROCEDURES CESSNA MODEL 172S There is no change to the airplane emergency procedures when used for Canadian operation. SECTION 4 NORMAL PROCEDURES There is no change to basic airplane normal operating procedures when used for Canadian operation. SECTION 5 PERFORMANCE There is no change to the airplane performance when used for Canadian operation. S12-4 July 8/98,109.25
319,"A Textron Company Pilot's Operating Handbook and FAA Approved Airplane Flight Manual CESSNA MODEL 172S AIRPLANES 17208113 AND ON SUPPLEMENT13 BENDIX/KING KCS-SSA SLAVED COMPASS SYSTEM WITH Kl-525A HORIZONTAL SITUATION INDICATOR (HSI) SERIAL NO. _______ _ REGISTRATION NO. ______ _ This supplement must be inserted into Section 9 of the Pilot's Operating Handbook and FAA Approved Airplane Flight Manual when Horizontal Situation Indicator is installed. FAA APPROVAL llAA APPROVED UNDER FAR 21 SUBPART J The Cessna Aircraft Co _~·~Option ManufacturerCE·1 ?'""~ti'~ ExecutiveEnam•r oa~e~:;ze 2000 f) Member of GAMA COPYRIGHT © 1999 CESSNA AIRCRAFT COMPANY WICHITA, KANSAS, USA 15 January 1999 Revision 1 - 30 May 2000 813-1 172SPHUS·S13·01",184.0
320,"SECTION 9 - SUPPLEMENTS SUPPLEMENT 13 - FAA APPROVED CESSNA MODEL 172S SUPPLEMENT13 BENDIX/KING KCS-55A SLAVED COMPASS SYSTEM WITH Kl-525A HORIZONTAL SITUATION INDICATOR (HSI) The following Log of Effective Pages provides the date of issue for original and revised pages, as well as a listing of all pages in the Supplement.  Pages which are affected by the current revision will carry the date of that revision Revision Level Date of Issue 0 (Original) 1 Jan. 15, 1999 May 30, 2000 LOG OF EFFECTIVITY PAGES PAGE Title (S13-1) S13-2 S13-3 S13-4 DATE May 30/00 May 30/00 May 30/00 Jan. 15/99 PAGE S13-5 S13-6 813-7 S13-8 DATE Jan. 15/99 Jan. 15/99 Jan. 15/99 Jan. 15/99 SERVICE BULLETIN CONFIGURATION LIST The following is a list of Service Bulletins that are applicable to the operation of the airplane, and have been incorporated into this supplement.  This list contains only those Service Bulletins that are currently active. Airplane Unit Revision Incorporated Number Title Effectivity Incorporation In Airplane S13-2 May 30/00",257.75
321,"CESSNA MODEL 172S SECTION 9 - SUPPLEMENTS SUPPLEMENT 13 - FAA APPROVED SUPPLEMENT13 BENDIX/KING KCS-55A SLAVED COMPASS SYSTEM WITH Kl-525A HORIZONTAL SITUATION INDICATOR (HSI) SECTION 1 GENERAL The Bendix/King KCS-55A Slaved Compass System with Kl- 525A HSI Indicator is an additional navigation indicator option.  The KCS-55A compass system includes a slaving control and compensator unit, magnetic slaving transmitter and a remote directional gyro. The information obtained from the KCS-55A compass system is displayed on the Kl-525A Indicator. The panel-mounted Kl-525A indicator combines the display functions of both the standard Directional Gyro (Heading Indicator) and the Course Deviation Indicator's VOR/LOC/Glideslope information to provide the pilot with a single visual presentation of the complete horizontal navigation situation. This system also incorporates a slaving accessory and compensator unit. This unit indicates any difference between thel displayed heading and the magnetic heading. Up deflection indicates a clockwise error of the compass card. Down deflection indicates a counterclockwise error of the compass card.  Whenever the aircraft is in a turn and the compass card rotates, it is normal for this meter to show a full deflection to one side or the other. May 30/00 S13-3",326.0
322,"SECTION 9 - SUPPLEMENTS SUPPLEMENT 13 - FAA APPROVED 2 3 15 13 4 5 10 CESSNA MODEL 172S Figure 1.  Horizontal Situation Indicator System (Sheet 1 of 2) 1.  HORIZONTAL SITUATION INDICATOR (HSI) -- Provides a pictorial presentation of aircraft deviation relative to VOR/GPS radials and localizer beams. It also displays glide slope deviations and gives heading reference with respect to magnetic north. The gyro is remote-mounted and electric- driven 2.  NAV FLAG -- Flag is in view when the NAV receiver signal is inadequate. 3.  HEADING REFERENCE (LUBBER LINE) -- Magnetic heading appears under this line when the compass card is slaved or slewed to the aircraft's magnetic heading. 4.  HEADING WARNING FLAG (HOG) -- When flag is in view, the heading display is invalid.",192.5
322,5.  COURSE SELECT POINTER -- Indicates VOR/Localizer or GPS course on the compass card.  The selected VOR radial or localizer heading remains set on the compass card when the compass card rotates. S13-4 Jan 15/99,53.0
323,CESSNA MODEL 172S SECTION 9 - SUPPLEMENTS SUPPLEMENT 13 - FAA APPROVED 6.  TO/FROM INDICATOR -- Indicates direction of VOR station relative to the selected course. Displays TO when a LOC frequency is selected. 7.  DUAL GLIDE SLOPE POINTERS -- Displays deviation of airplane from an ILS glideslope. Full scale deflection of the glideslope pointers represents ±0.7 degrees.  Pointers will be out of view if an invalid glideslope signal is received. 8.  GLIDE SLOPE SCALES -- Indicates displacement from glide slope beam center.  A glide slope deviation bar displacement of 2 dots represents full-scale (0.7°) deviation above or below glide slope beam centerline.,165.0
323,"9.  HEADING SELECTOR KNOB (1¥' )-- Positions the heading bug on compass card by rotating the heading selector knob. The bug rotates with the compass card. 10.  COMPASS CARD -- Rotates to display heading of airplane with reference to lubber line on HSI. 11.  COURSE SELECTOR KNOB ( t )-- Positions the course bearing pointer on the compass card by rotating the course selector knob. 12.  COURSE DEVIATION BAR (D-BAR) - The center portion of the omni bearing pointer moves laterally to pictorially indicate the relationship of airplane to the selected course.  It indicates degrees of angular displacement from VOR radials and localizer beams, or displacement in nautical miles from GPS desired course.",175.0
323,"13.  COURSE DEVIATION SCALE -- A course deviation bar displacement of 5 dots represents full scale (VOR = ±10°, LOC = ±2-1/2°, GPS = 5nm enroute, GPS APR = .3nm) deviation from beam centerline. 14.  HEADING BUG -- Moved by (1¥') knob to select desired heading. 15.  SYMBOLIC AIRCRAFT -- Provides pictorial presentation of the airplane position and intercept angle relative to selected VOR Radial or localizer course. Figure 1.  Horizontal Situation Indicator System (Sheet 2 of 2) Jan 15/99 S13-5",124.0
324,"SECTION 9 - SUPPLEMENTS SUPPLEMENT 13 - FAA APPROVED 4 2 3 CESSNA MODEL 172S Figure 2.  KA-51 B Slaving Accessory and Compensator Unit 1.  KA-51 B SLAVING ACCESSORY AND COMPENSATOR UNIT -- Controls the KCS-55A Compass System. 2.  MANUAUAUTOMATIC (FREE/SLAVE) COMPASS SLAVE SWITCH -- Selects either the manual or automatic slaving mode for the Compass System. 3.  CW/CCW COMPASS MANUAL SLAVE SWITCH -- With the manual/automatic compass slave switch in the FREE position, allows manual compass card slaving in either the clockwise or counterclockwise direction.  The switch is spring loaded to the center position. 4.  SLAVING METER -- Indicates the difference between the displayed heading and the magnetic heading.",178.5
324,Up deflection indicates a clockwise error of the compass card. Down deflection indicates a counterclockwise error of the compass card. S13-6 Jan 15/99,37.5
325,"CESSNA MODEL 172S SECTION 9 - SUPPLEMENTS SUPPLEMENT 13 - FAA APPROVED SECTION 2 LIMITATIONS There is no change to the airplane limitations when this instrument is installed. SECTION 3 EMERGENCY PROCEDURES There is no change to the airplane emergency procedures when this instrument is installed. SECTION 4 NORMAL PROCEDURES AcAUTION ELECTRICAL POWER MUST BE SUPPLIED TO THIS INSTRUMENT FOR PROPER FUNCTIONING. ABSENCE OF WHICH WILL RESULT IN UNRELIABLE HEADING INFORMATION. Normal procedures for operation of this system differ little from those required for the more conventional Course Deviation Indicators.  However, several small differences are worth noting. The rectilinear movement of the course deviation bar in combination with the rotation of the compass card in response to heading changes, provides an intuitive picture of the navigation situation at a glance when tuned to an omni station.  When tuned to a localizer frequency, the course select pointer must be set to the inbound front course for both front and back-course approaches to retain this pictorial presentation. Jan 15/99 S13-7",276.0
326,"SECTION 9 - SUPPLEMENTS SUPPLEMENT 13 - FAA APPROVED CESSNA MODEL 172S For normal procedures with autopilots, refer to the Autopilot Supplements in the Supplement section of this handbook. A description of course datum and autopilot procedures for course datum are incorporated in the appropriate autopilot supplements. SECTION 5 PERFORMANCE There is no change to the airplane performance when this instrument is installed. S13-8 Jan 15/99",109.75
327,"A Textron Company Pilot's Operating Handbook and FAA Approved Airplane Flight Manual CESSNA MODEL 172S AIRPLANES 172S8348 AND ON SUPPLEMENT15 BENDIX/KING KAP 140 2 AXIS AUTOPILOT SERIAL NO. _______ _ REGISTRATION NO. ______ _ This supplement must be inserted into Section 9 of the Pilot's Operating Handbook and FAA Approved Airplane Flight Manual when the KAP 140 2 Axis Autopilot System is installed. COPYRIGHT © 1999 CESSNA AIRCRAFT COMPANY WICHITA, KANSAS, USA 172SPHUS-S15-05 FAA APPROVAL l!AA APPROVl:O UNDER FAR 21 SUBPART J The Cessna Aircraft Co _ ~ation Option Manufacturer CE· 1 7'~.  I~ ExecutiYoEngmeer Date: 28 December 1999 f) Member of GAMA 28 December 1999 Revision 5 - 4 June 2003 S15-1",176.0
328,"SECTION 9 - SUPPLEMENTS SUPPLEMENT 15 - FAA APPROVED CESSNA MODEL 172S SUPPLEMENT15 BENDIX/KING KAP 140 2 AXIS AUTOPILOT Use the Log of Effective Pages to determine the current status of this supplement. Pages affected by the current revision are indicated by an asterisk (*) preceeding the page number. Supplement Status Date Original Issue Revision 1 Revision 2 Revision 3 Revision 4 Revision 5 28 December 1999 30 May 2000 30 December 2000 28 June 2002 31 October 2002 4 June 2003 LOG OF EFFECTIVE PAGES Page * S15-1 thru S15-20 * S15-20A thru S15-208 * S15-21 thru S15-32 * S15-33 thru S15-36 APPROVED BY Page Status Revision Number Revised Deleted Revised Added FAA APPROVED UNDER FAR 21 SUBPART J Thee..a..  AIR:ralleo. • Delegation ()paon Aulhorization OQA.100129-CE ~~ ""--E~ 5 5 5 5 DATE OF APPROVAL S15-2 Revision 5",206.0
329,"CESSNA MODEL 172S SECTION 9 - SUPPLEMENTS SUPPLEMENT 15 - FAA APPROVED SUPPLEMENT15 BENDIX/KING KAP 140 2 AXIS AUTOPILOT SERVICE BULLETIN CONFIGURATION LIST The following is a list of Service Bulletins that are applicable to the operation of the airplane, and have been incorporated into this supplement.  This list contains only those Service Bulletins that are currently active. KC-140-M1 (Honeywell Service Bulletin) Revision 5 KAP 140 AP Airplane Serial Revision Incorporated EfteciiVlty Incorporation In Airplane Revision 3",132.0
330,"SECTION 9 - SUPPLEMENTS SUPPLEMENT 15 - FAA APPROVED CESSNA MODEL 172S I SUPPLEMENT 15 BENDIX/KING KAP 140 2 AXIS AUTOPILOT SECTION 1 GENERAL IThe KAP 140 2 Axis Autopilot provides the pilot with the following features: Vertical Speed mode (VS); Altitude hold (ALT); Wing Level (ROL); Heading select (HDG); Approach (APR); ILS coupling to Localizer (LOC) and Glideslope (GS); and backcourse (REV) modes of operation.  The optional KAP 140, 2 Axis Autopilot with Altitude Preselect (if installed) adds Altitude Alerter and Altitude Preselect capabilities. IThe KAP 140 2 Axis Autopilot has an electric trim system which provides autotrim during autopilot operation and manual electric trim (MET) for the pilot when the autopilot is not engaged.  The electric trim system is designed to be fail safe for any single inflight trim malfunction.  Trim faults are visually and aurally annunciated. A lockout device prevents autopilot or MET engagement until the lsystem has successfully passed preflight self-test. Automatic preflight self-test begins with initial power application to the autopilot. The following conditions will cause the autopilot to disengage: A. Electric Power failure. B. Internal Autopilot System failure. C. Pitch accelerations in excess of + 1.4g or less than +0.6g only when produced by a failure causing servo runaway.",334.75
330,The I pilot cannot maneuver the airplane and trip the monitor. D. Turn coordinator failure (small square red flag visible on instrument). E. Computer autopilot monitor that detects either the R (ROLL) or P (PITCH) axis annunciator. I S15-4 Revision 5,62.5
331,"CESSNA MODEL 172S SECTION 9 - SUPPLEMENTS SUPPLEMENT 15 - FAA APPROVED Activation of A/P DISC/TRIM INT control wheel switch will also disconnect the autopilot. The AVIONICS MASTER switch supplies power to the avionics bus bar of the radio circuit breakers and the autopilot circuit breaker. The AVIONICS MASTER switch also serves as an emergency AP/MET shutoff. The following circuit breakers are used to protect the KAP 140 2 Axis Autopilot: I LABEL AUTO PILOT WARN FUNCTIONS Pull-off circuit breaker supplies power to the KC 140 Computer and the autopilot pitch, roll and pitch trim servos. Supplies separate power for autopilot alerting (PITCH TRIM) on the airplane's annunciator panel. At 172S serial number 172S9423 and On, automated Roll Steering functionality has been added to the Bendix/King KLN 94 GPS Navigation System and the KAP 140 2 Axis Autopilot System.  Roll Steering coupling between the GPS and the Autopilot provides area navigation with automatic course changes at flight plan waypoints similar to Flight Management System (FMS) operations, but without vertical navigation capability.  The Roll Steering function is similar to ""turn anticipation"" for the autopilot. At the noted serial effectivity, the KLN 94 GPS (ORS 03 or later) has an added Roll Steering signal output.  In order for the GPS Roll Steering output to be utilized, the KAP 140 Autopilot (-7904 or later) has an added input for the Roll Steering signal and additional system wiring has been added to the airplane to connect the Roll Steering signal output from the KLN 94 GPS to the Roll Steering input of the KAP 140 Autopilot.",404.25
332,"SECTION 9 - SUPPLEMENTS SUPPLEMENT 15 - FAA APPROVED NAV/COMM 1 CESSNA MODEL 172S r---- PILOT I I I NAVIGATION SOURCE 12 ''""""-'t!llL .....------. SELECTOR 14 • GPS SWITCH TURN COORDINATOR LEV ATOR ACTUATOR ELEV ATOR TRIM ACTUATOR ELECTRICAL BUS 07851026 I Figure 1.  Bendix/King KAP 140 2 Axis Autopilot Schematic (Serials 172S8348 thru 172S9422) (Sheet 1 of 2) I S15-6 Revision 5",95.0
333,"CESSNA MODEL 172S NAV/COMM 1 li!;JJJD I I 11.bD 3!?5~ NAVIGATION SECTION 9 - SUPPLEMENTS SUPPLEMENT 15 - FAA APPROVED r---- 1 I I SOURCE 12 ''""""-11iiL ....------.  SELECTOR 14 • GPS SWITCH URN COORDINATOR ROLL STEERING LEV ATOR ACTUATOR ELEVATOR TRIM ACTUATOR 07851026 _.. Figure 1.  Bendix/King KAP 140 2 Axis Autopilot Schematic (Serials 172S9423 and On) (Sheet 2) Revision 5",94.25
334,"SECTION 9 - SUPPLEMENTS SUPPLEMENT 15 - FAA APPROVED 18** BENDIX 1 , ""' r: ri\ii'1 n 1 T KING n v u ~ .--; L. I KAP 140 p R 16 2 p 50[1 T FPM 3 4 5 6 7 8 CESSNA MODEL 172S 9 KAP 140 WITHOUT ALTITUDE PRESELECT 1.  PITCH AXIS (P) ANNUNCIATOR -- When illuminated, indicates failure of pitch axis and will either disengage the autopilot or not allow engagement of the pitch axis. In turbulent air, will illuminate during abnormal vertical/accelerations. 2.  AUTOPILOT ENGAGE/DISENGAGE (AP) BUTTON -- When pushed*, or pressed and held (approx.0.25 seconds)**, engages autopilot if all preflight self-test conditions are met. The autopilot will engage in the basic roll (ROL) mode which functions as a wing leveler and the pitch axis vertical speed (VS) mode.  The commanded vertical speed will be displayed in the upper right corner of autopilot display area. The captured VS will be the vertical speed present at the moment the AP button is pressed. The button may also be used to disengage the autopilot.",250.25
334,"3.  ROLL AXIS (R) ANNUNCIATOR -- When illuminated, indicates failure of the roll axis and disengages the autopilot. * Airplane serials 172S8348 thru 172S9128 not incorporating Honeywell Service Bulletin KC140-M1. ** Airplane serials 172S8348 thru 172S9128 incorporating Honeywell Service Bulletin KC140-M1, and airplane serials 172S9129 and on. I Figure 2.  Bendix/King KAP 140 2 Axis Autopilot, Operating Controls and Indicators (Sheet 1 of 4) S15-8 Revision 5",115.25
335,"CESSNA MODEL 172S SECTION 9 - SUPPLEMENTS SUPPLEMENT 15 - FAA APPROVED 4.  HEADING (HOG) MODE SELECTOR BUTTON -- When pushed, will select the Heading mode, which commands the airplane to turn to and maintain the heading selected by the heading bug on the Directional Gyro or HSI (if installed).  A new heading may be selected at any time and will result in the airplane turning to the new heading.  The button can also be used to toggle between HOG and ROL modes. For airplane serials 172S8348 thru 172S9128 not incorporating Honeywell Service Bulletin KC140-M1, this button can also be used to engage the autopilot in HOG mode. 5.  NAVIGATION (NAV) MODE SELECTOR BUTTON -- When pushed, will select the Navigation mode.  This mode provides automatic beam capture and tracking of VOR, LOC, or GPS signals as selected for presentation on the #1 CDI. NAV mode is recommended for enroute navigation tracking. 6.",226.75
335,"APPROACH (APR) MODE SELECTOR BUTTON -- When pushed, will select the Approach mode.  This mode provides automatic beam capture and tracking of VOR, GPS, LOC and Glideslope (GS) on an ILS, as selected for presentation on #1 CDI. APR mode tracking sensitivity is recommended for instrument approaches. 7.  BACK COURSE APPROACH (REV) MODE BUTTON -- This button is active only when the coupled navigation receiver is tuned to a LOC/ILS frequency.  When pushed will select the Back Course approach mode.  This mode functions identically to the approach mode except that the autopilot response to LOC signals is reversed.  Glideslope is locked out with REV mode. 8.  ALTITUDE HOLD (ALT) MODE SELECT BUTTON -- When pushed, will select the altitude hold mode.",187.5
335,"This mode provides capture and tracking of the selected altitude. The selected altitude is the airplane altitude at the moment the ALT button is pressed.  If the ALT button is pressed with an established VS rate present, there will be about a 10% (of VS rate) overshoot. The airplane will return positively to the selected altitude. For airplane serials 172S8348 thru 172S9128 not incorporating Honeywell Service Bulletin KC140-M1, this button can also be used to engage the autopilot in ALT mode. Figure 2.  Bendix/King KAP 140 2 Axis Autopilot, Operating Controls and Indicators (Sheet 2) I Revision 5 S15-9",152.25
336,"SECTION 9 - SUPPLEMENTS SUPPLEMENT 15 - FAA APPROVED CESSNA MODEL 172S 9.  VERTICAL SPEED (UP/DN) MODE BUTTONS -- The action of these buttons depends on the vertical mode present when pressed.  If VS mode is active (AP plus any lateral mode) and the UP button is pressed, the autopilot will modify the displayed VS command (FPM) in the up direction. Single momentary cycles on either the UP or DN button will increment the VS command by 100 FPM per cycle. When either button is continuously held in, it will modify the vertical speed command by 300 fpm per second. If ALT mode is active, pressing the UP/DN buttons will modify the captured altitude by 20 feet per cycle, or if held continuously will command the airplane up or down at the rate of 500 FPM, synchronizing the ALT reference to the actual airplane altitude upon button release. 10.  AUTO PILOT CIRCUIT BREAKER -- A 5-amp pull-off circuit breaker supplying 28 VDC to the KAP 140 system. 11.  WARN C/B -- Power to the autopilot disconnect horn and the airplane's annunciator panel (PITCH TRIM).",263.75
336,"12.  AUTOPILOT DISCONNECT (A/P DISC/TRIM INT) SWITCH -- When depressed will disengage the autopilot and interrupt manual electric trim (MET) power. An autopilot disconnect will be annunciated by a continuous 2 second tone accompanied by flashing ""AP"" annunciations on the autopilot computer display. 13.  MANUAL ELECTRIC TRIM (MET) SWITCHES -- When both switches are pressed in the same direction, the trim system will provide pitch trim in the selected direction.  Use of manual electric trim during autopilot operation will disengage the autopilot. I Figure 2.  Bendix/King KAP 140 2 Axis Autopilot, Operating Controls and Indicators (Sheet 3) S 15-1 0 Revision 5",166.25
337,"CESSNA MODEL 172S SECTION 9 - SUPPLEMENTS SUPPLEMENT 15 - FAA APPROVED 14.  OMNI BEARING SELECT (OBS) KNOB -- Selects the desired course to be tracked by the autopilot. (Note: The HOG bug must also be positioned to the proper course to capture and track the selected radial or desired track). 15.  HEADING SELECT KNOB (HOG) -- Positions the heading pointer (""bug"") on the compass card. Note that the position of the heading bug also provides course datum to the autopilot when tracking in NAV, APR, or REV (BC) modes. This is in addition to its more intuitive use in the HOG mode. 16.  PITCH TRIM (PT) Annunciator -- Indicates the direction of required pitch trim. The annunciation will flash if auto trim has not satisfied the request for trim for a period of 10 seconds.",193.0
337,"A solid ~ without an arrowhead is an indication of a pitch trim fault.  Refer to the EMERGENCY PROCEDURES for proper response to a pitch trim fault. 17.  PITCH TRIM Annunciation (located on instrument panel or glareshield) -- Illuminates whenever the automated preflight self test detects a pitch trim fault or the continuous monitoring system detects a pitch trim fault in flight. Refer to the EMERGENCY PROCEDURES for proper response to a pitch trim fault. ••18.  AUTOPILOT ENGAGE I AP I Annunciation -- Illuminates whenever the autopilot is engaged. Flashes during pilot initiated or automatic disengagement. **Airplane serials 172S8348 thru 172S9128 incorporating Honeywell Service Bulletin KC140-M1, and airplane serials 172S9129 and on. Figure 2.",188.0
337,"Bendix/King KAP 140 2 Axis Autopilot, Operating Controls and Indicators (Sheet 4) I Revision 5 S15-11",25.25
338,"SECTION 9 - SUPPLEMENTS SUPPLEMENT 15 - FAA APPROVED CESSNA MODEL 172S 5 4 3 2 II I I BENDIX n1T k snn I I ""1'.r= KING nv u f1LJ KAP 140 T FPM [I UP 11 ... p R [0 IHDGI INAVI IAPRI IREVI IALTI I DN I \ KAP 140 WITH ALTITUDE PRESELECT NOTE Numbered items apply to the KAP 140 with Altitude Preselect.  Other controls and indicators shown are the same as those on the KAP 140 without Altitude Preselect (refer to Figure 2). \ .1 1 .  ROT ARY KNOBS -- Used to set the altitude alerter reference altitude; or may be used immediately after pressing the BARO button, to adjust the autopilot baro setting to match that of the airplane's altimeter when manual adjustment is required. (In some systems, the baro setting may be automatically synched to that of the altimeter.) 2.  BARO SET (BARO) BUTTON -- When pushed and released, will change the display from the altitude alerter selected altitude to the baro setting display (either IN HG or HPA) for 3 seconds. If pushed and held for 2 seconds, will change the baro setting display from IN HG to HPA or vice versa.  Once the baro setting display is visible the rotary knobs may be used to adjust the baro setting.",289.5
338,"I Figure 3.  Bendix/King KAP 140 2 Axis Autopilot with Altitude Preselect, Operating Controls and Indicators (Sheet 1 of 2) S15-12 Revision 5",35.25
